{
  "user_id": "default",
  "preferences": {
    "break_ratio": {"work_minutes": 50, "break_minutes": 10},
    "preferred_study_time": "20:00-23:00"
  },
  "fixedEvents": [
    {"id": "e1", "title": "College", "start": "2025-10-20T09:00:00", "end": "2025-10-20T16:00:00", "recurring": "weekdays"}
  ],
  "tasks": [
    {"id": "t1", "title": "DSA practice", "estimated_minutes": 90, "priority": "important", "category": "study"},
    {"id": "t2", "title": "Physics revision", "estimated_minutes": 120, "priority": "urgent", "category": "study"}
  ],
  "goals": [],
  "classes": [],
  "syllabusNotes": []
}
